{
  "id": "A-pluto_B-mercury_conjunction",
  "kind": "interaspect",
  "planetA": "pluto",
  "planetB": "mercury",
  "aspect": "conjunction",
  "plainTranslation": "This person has a way of reaching the thoughts beneath your thoughts. Mercury-Pluto conjunctions tend to create an immediate psychic charge in conversation. The Pluto person may seem to sense what the Mercury person means before it is fully spoken, picking up on subtext, silence, and the stories hiding between the lines. They often ask questions that cut straight to the heart of the matter, focusing on what is hidden, unresolved, or difficult to put into words.\n\nAt first, this can feel fascinating. The Mercury person may feel deeply heard, mentally challenged, and understood in a way that goes beyond ordinary conversation. The Pluto person often takes their words seriously and wants to know what is underneath them. This can create a rare kind of intellectual and psychological intimacy.\n\nBut this aspect can become overwhelming if healthy boundaries are not respected. Conversations may start to carry more emotional weight than either person realizes, even when discussing everyday topics. The Mercury person may begin to feel scrutinized or overly analyzed, while the Pluto person may feel a strong urge to keep digging for deeper answers. When one person pushes for vulnerability before the other is ready, genuine connection can start to feel like pressure instead of trust-building. At its worst, it can create mental control, obsession, interrogation, or a dynamic where one person feels constantly analyzed.\n\nAt its best, this aspect creates honest, transformative dialogue. It can help both people think more clearly, speak more truthfully, and uncover what has been hidden or avoided. The lesson is simple: truth does not need to be forced. A powerful conversation should leave both people clearer, not cornered.",
  "policy": "Governed by synastry-policy. Descriptive, not deterministic; intensity is never treated as obligation, safety concerns override astrology.",
  "note": "Imported from authored synastry material (synastry-authored__19_ (2).json). Source file was not copied into the repository.",
  "voiceNeutral": true,
  "status": "DRAFT"
}
