{
  "id": "A-mercury_B-moon_square",
  "kind": "interaspect",
  "planetA": "mercury",
  "planetB": "moon",
  "aspect": "square",
  "plainTranslation": "This person may say the thing in a way that lands wrong.\n\nThey may ask a simple question and it feels like criticism. They may try to explain your feelings and it sounds like they are correcting you. They may reach for logic at the exact moment you need warmth. The problem is not always what they say. It is how it lands in your body.\n\nThis can become exhausting if it keeps happening. You may start bracing before the conversation even begins. They may feel like they are trying to help, while you feel like you are being studied. You may feel pressured to explain your emotions clearly before you have even had a chance to understand them yourself.\n\nWhen this works, it can make both people more skilled. You learn to say what you feel more directly. They learn to listen without rushing to organize or solve. The friction becomes useful when both people stop defending their method and start caring about the impact.\n\nThe deeper challenge is the temptation to become certain too quickly. One person decides they already know what the feeling means. The other decides they are not being heard. Then the conversation becomes less about understanding and more about protection.\n\nSlow down. Put comfort before analysis. Say what landed. Ask what was meant. This connection improves when both people stop treating emotional clarity as something that can be forced.",
  "policy": "Governed by synastry-policy. Descriptive, not deterministic; intensity is never treated as obligation, safety concerns override astrology.",
  "note": "Imported from authored synastry material (synastry-authored__19_ (2).json). Source file was not copied into the repository.",
  "voiceNeutral": true,
  "status": "DRAFT"
}
