{
  "id": "A-uranus_B-mars_trine",
  "kind": "interaspect",
  "planetA": "uranus",
  "planetB": "mars",
  "aspect": "trine",
  "plainTranslation": "A's need for freedom meets B's drive. The trine lets them flow together easily.",
  "policy": "Governed by synastry-policy. Descriptive, not deterministic; intensity is never treated as obligation, safety concerns override astrology.",
  "note": "Imported from project-authored synastry matrix material. Source file was not copied into the repository.",
  "voiceNeutral": true,
  "status": "DRAFT",
  "summaryShort": "Their unpredictability and push for change work smoothly with your drive, timing, and willingness to act.",
  "summaryDeep": "Their unpredictability and push for change work smoothly with your drive, timing, and willingness to act. It runs easily and asks little, quietly steadying the rest of the bond. Lean on how naturally this one lines up.",
  "authoringStatus": "draft"
}
