{
  "id": "A-sun_B-uranus_opposition",
  "kind": "interaspect",
  "planetA": "sun",
  "planetB": "uranus",
  "aspect": "opposition",
  "plainTranslation": "A's identity meets B's need for freedom. The opposition pulls them into push-and-pull.",
  "policy": "Governed by synastry-policy. Descriptive, not deterministic; intensity is never treated as obligation, safety concerns override astrology.",
  "note": "Imported from project-authored synastry matrix material. Source file was not copied into the repository.",
  "voiceNeutral": true,
  "status": "DRAFT",
  "summaryShort": "Their sense of identity, confidence, and direction press against your need for freedom and openness to change.",
  "summaryDeep": "Their sense of identity, confidence, and direction press against your need for freedom and openness to change. It catches often enough that you both feel it, and it keeps asking to be worked out. Name it directly instead of letting it build in silence.",
  "authoringStatus": "draft"
}
