{
  "id": "A-moon_B-jupiter_trine",
  "kind": "interaspect",
  "planetA": "moon",
  "planetB": "jupiter",
  "aspect": "trine",
  "plainTranslation": "A's feelings meets B's growth. The trine lets them flow together easily.",
  "policy": "Governed by synastry-policy. Descriptive, not deterministic; intensity is never treated as obligation, safety concerns override astrology.",
  "note": "Imported from project-authored synastry matrix material. Source file was not copied into the repository.",
  "voiceNeutral": true,
  "status": "DRAFT"
}
