{
  "id": "A-venus_B-ascendant_opposition",
  "kind": "interaspect",
  "planetA": "venus",
  "planetB": "ascendant",
  "aspect": "opposition",
  "plainTranslation": "Their affection, preferences, and wish to keep things pleasant press against how freely you present yourself and enter situations.",
  "policy": "Governed by synastry-policy. Descriptive, not deterministic; intensity is never treated as obligation, safety concerns override astrology.",
  "note": "Merged from cc-synastry-web-bundle.json.",
  "voiceNeutral": true,
  "status": "DRAFT",
  "authoringStatus": "draft",
  "summaryShort": "Their affection, preferences, and wish to keep things pleasant press against how freely you present yourself and enter situations.",
  "summaryDeep": "Their affection, preferences, and wish to keep things pleasant press against how freely you present yourself and enter situations. It catches often enough that you both feel it, and it keeps asking to be worked out. Name it directly instead of letting it build in silence."
}
