{
  "id": "A-mercury_B-saturn_opposition",
  "kind": "interaspect",
  "planetA": "mercury",
  "planetB": "saturn",
  "aspect": "opposition",
  "plainTranslation": "Open thinking faces serious skepticism. The Mercury person wants to explore and talk; the Saturn person wants proof and caution. Useful tension that can curdle into the other feeling dismissed. Failure mode: one voice consistently overruling the other.",
  "policy": "Governed by synastry-policy. Descriptive, not deterministic; intensity is never treated as obligation, safety concerns override astrology.",
  "note": "Synced from authored synastry bundle synastry-authored__19_ (2).json.",
  "voiceNeutral": true,
  "status": "DRAFT",
  "summaryDeep": "Their questions, explanations, and way of talking press against your commitments, limits, and self-discipline. It catches often enough that you both feel it, and it keeps asking to be worked out. Name it directly instead of letting it build in silence.",
  "tension": "They may think your ideas are unrealistic. You may think they are rigid and overly controlling. Conversations can turn into arguments where both people are trying to prove the other one wrong. The opportunity here is learning to value different ways of solving problems. Some insights come from asking questions and exploring possibilities. Others come from hands-on experience, pattern recognition, or careful analysis. The strongest results often come from combining these approaches rather than treating them as competing strengths.",
  "advice": "Let this connection teach you how to evaluate feedback without losing confidence in your own perspective. Let go of criticism that undermines your confidence or discourages you from contributing your ideas. Let Saturn's rigor and Mercury's range balance, not silence, each other.",
  "weight": 4,
  "authoringStatus": "draft",
  "summaryShort": "Their questions, explanations, and way of talking press against your commitments, limits, and self-discipline."
}
