{
  "id": "A-jupiter_B-venus_opposition",
  "kind": "interaspect",
  "planetA": "jupiter",
  "planetB": "venus",
  "aspect": "opposition",
  "plainTranslation": "This person may bring more. More generosity. More enthusiasm. More willingness to say yes to what feels good. Part of you may find that deeply refreshing. Another part may wonder where the limit is. They can encourage you to open up to life's pleasures while also challenging your sense of balance, moderation, and what feels sustainable.\n\nThis connection asks both of you to examine your relationship with receiving. They may encourage you to loosen your grip, trust life a little more, and stop acting as though joy always has to be justified. You may help them recognize when enough is enough and make better choices about where their time, energy, and generosity go.\n\nThe tension appears when your differences start to feel like judgments. A difference in perspective can slowly harden into a question of whose truth gets to lead. They may experience your caution as a limit on what is possible, while you may experience their faith in expansion as a refusal to acknowledge reality. Over time, what began as a difference in style can become a story about who has the better way of moving through life.\n\nThis connection is not about proving whose approach is right. It is about recognizing that both of your instincts can become excessive in different ways, and finding a balance that serves the relationship better than either extreme. Neither person needs to become the other. The goal is to find a balance where generosity has room to breathe and good judgment still has a voice.",
  "policy": "Governed by synastry-policy. Descriptive, not deterministic; intensity is never treated as obligation, safety concerns override astrology.",
  "note": "Imported from authored synastry material (synastry-authored__19_ (2).json). Source file was not copied into the repository.",
  "voiceNeutral": true,
  "status": "DRAFT"
}
