{
  "id": "A-venus_B-sun_sextile",
  "kind": "interaspect",
  "planetA": "venus",
  "planetB": "sun",
  "aspect": "sextile",
  "plainTranslation": "A's love and values meets B's identity. The sextile supports them, if you act on it.",
  "policy": "Governed by synastry-policy. Descriptive, not deterministic; intensity is never treated as obligation, safety concerns override astrology.",
  "note": "Imported from project-authored synastry matrix material. Source file was not copied into the repository.",
  "voiceNeutral": true,
  "status": "DRAFT"
}
