{
  "id": "A-saturn_B-saturn_opposition",
  "kind": "interaspect",
  "planetA": "saturn",
  "planetB": "saturn",
  "aspect": "opposition",
  "plainTranslation": "A's structure meets B's structure. The opposition pulls them into push-and-pull.",
  "policy": "Governed by synastry-policy. Descriptive, not deterministic; intensity is never treated as obligation, safety concerns override astrology.",
  "note": "Imported from project-authored synastry matrix material. Source file was not copied into the repository.",
  "voiceNeutral": true,
  "status": "DRAFT"
}
