{
  "id": "A-ascendant_B-uranus_conjunction",
  "kind": "interaspect",
  "planetA": "ascendant",
  "planetB": "uranus",
  "aspect": "conjunction",
  "plainTranslation": "Their presence and the way they carry themselves sit right on top of your need for freedom and openness to change.",
  "policy": "Governed by synastry-policy. Descriptive, not deterministic; intensity is never treated as obligation, safety concerns override astrology.",
  "note": "Merged from cc-synastry-web-bundle.json.",
  "voiceNeutral": true,
  "status": "DRAFT",
  "authoringStatus": "draft",
  "summaryShort": "Their presence and the way they carry themselves sit right on top of your need for freedom and openness to change.",
  "summaryDeep": "Their presence and the way they carry themselves sit right on top of your need for freedom and openness to change. This is one of the closest contacts between you, strong and constant, energizing at its best and a lot to hold at its worst. Let the closeness feed you without letting it run you."
}
