{
  "id": "A-neptune_B-neptune_trine",
  "kind": "interaspect",
  "planetA": "neptune",
  "planetB": "neptune",
  "aspect": "trine",
  "plainTranslation": "A's dreams meets B's dreams. The trine lets them flow together easily.",
  "policy": "Governed by synastry-policy. Descriptive, not deterministic; intensity is never treated as obligation, safety concerns override astrology.",
  "note": "Imported from project-authored synastry matrix material. Source file was not copied into the repository.",
  "voiceNeutral": true,
  "status": "DRAFT",
  "summaryShort": "Their idealism, vagueness, and dreams work smoothly with your imagination, hope, and idealism.",
  "summaryDeep": "Their idealism, vagueness, and dreams work smoothly with your imagination, hope, and idealism. It runs easily and asks little, quietly steadying the rest of the bond. Lean on how naturally this one lines up.",
  "authoringStatus": "draft"
}
