{
  "id": "A-moon_B-midheaven_opposition",
  "kind": "interaspect",
  "planetA": "moon",
  "planetB": "midheaven",
  "aspect": "opposition",
  "plainTranslation": "Their moods, needs, and habits of comfort press against your direction, ambitions, and public reputation.",
  "policy": "Governed by synastry-policy. Descriptive, not deterministic; intensity is never treated as obligation, safety concerns override astrology.",
  "note": "Merged from cc-synastry-web-bundle.json.",
  "voiceNeutral": true,
  "status": "DRAFT",
  "authoringStatus": "draft",
  "summaryShort": "Their moods, needs, and habits of comfort press against your direction, ambitions, and public reputation.",
  "summaryDeep": "Their moods, needs, and habits of comfort press against your direction, ambitions, and public reputation. It catches often enough that you both feel it, and it keeps asking to be worked out. Name it directly instead of letting it build in silence."
}
