{
  "id": "A-uranus_B-mercury_conjunction",
  "kind": "interaspect",
  "planetA": "uranus",
  "planetB": "mercury",
  "aspect": "conjunction",
  "plainTranslation": "This can feel like finding someone whose mind moves at your speed.\n\nThe attraction is often mental first. Conversation starts quickly and may become exciting almost immediately. One person makes a leap, the other catches it. One says something strange or unexpected, and instead of being confused, the other adds to it. That can feel rare.\n\nThere is a kind of intimacy in being understood this quickly. You do not have to slow yourself down as much. You do not have to make every idea acceptable before saying it. With this person, your mind may feel freer, sharper, and more willing to say what it usually edits.\n\nAt its best, this connection can produce real breakthroughs. You may think better together than apart. One of you brings the sudden insight. The other helps give it language. Together, you can turn a strange idea into something other people can actually understand.\n\nThe challenge is staying with one thing long enough to finish it.\n\nThe conversation can be so stimulating that commitment to one idea starts to feel boring. You may keep chasing the next flash instead of building anything with the one you already had. A hundred ideas can pass between you and still leave nothing real behind.\n\nThere can also be nervous tension here. Too much talking, too much stimulation, too many new angles at once can make both people feel wired. Emotional conversations can suffer too. When a feeling comes up, it may be easier to turn it into a theory than to actually sit with it.\n\nWhat helps is giving the energy a body. Talk while you walk. Cook while you brainstorm. Write things down. Pick one idea and see it through.\n\nThe brilliance is already there. The work is finishing.",
  "policy": "Governed by synastry-policy. Descriptive, not deterministic; intensity is never treated as obligation, safety concerns override astrology.",
  "note": "Imported from authored synastry material (mercury_uranus.json). Source file was not copied into the repository.",
  "voiceNeutral": true,
  "status": "DRAFT"
}
