{
  "id": "A-uranus_B-neptune_opposition",
  "kind": "interaspect",
  "planetA": "uranus",
  "planetB": "neptune",
  "aspect": "opposition",
  "plainTranslation": "A's need for freedom meets B's dreams. The opposition pulls them into push-and-pull.",
  "policy": "Governed by synastry-policy. Descriptive, not deterministic; intensity is never treated as obligation, safety concerns override astrology.",
  "note": "Imported from project-authored synastry matrix material. Source file was not copied into the repository.",
  "voiceNeutral": true,
  "status": "DRAFT",
  "summaryShort": "Their unpredictability and push for change press against your imagination, hope, and idealism.",
  "summaryDeep": "Their unpredictability and push for change press against your imagination, hope, and idealism. It catches often enough that you both feel it, and it keeps asking to be worked out. Name it directly instead of letting it build in silence.",
  "authoringStatus": "draft"
}
