{
  "id": "A-pluto_B-uranus_trine",
  "kind": "interaspect",
  "planetA": "pluto",
  "planetB": "uranus",
  "aspect": "trine",
  "plainTranslation": "A's depth and power meets B's need for freedom. The trine lets them flow together easily.",
  "policy": "Governed by synastry-policy. Descriptive, not deterministic; intensity is never treated as obligation, safety concerns override astrology.",
  "note": "Imported from project-authored synastry matrix material. Source file was not copied into the repository.",
  "voiceNeutral": true,
  "status": "DRAFT",
  "summaryShort": "Their intensity and pull toward depth and control work smoothly with your need for freedom and openness to change.",
  "summaryDeep": "Their intensity and pull toward depth and control work smoothly with your need for freedom and openness to change. It runs easily and asks little, quietly steadying the rest of the bond. Lean on how naturally this one lines up.",
  "authoringStatus": "draft"
}
