{
  "id": "A-ascendant_B-mars_sextile",
  "kind": "interaspect",
  "planetA": "ascendant",
  "planetB": "mars",
  "aspect": "sextile",
  "plainTranslation": "Their presence and the way they carry themselves work smoothly with your drive, timing, and willingness to act.",
  "policy": "Governed by synastry-policy. Descriptive, not deterministic; intensity is never treated as obligation, safety concerns override astrology.",
  "note": "Merged from cc-synastry-web-bundle.json.",
  "voiceNeutral": true,
  "status": "DRAFT",
  "authoringStatus": "draft",
  "summaryShort": "Their presence and the way they carry themselves work smoothly with your drive, timing, and willingness to act.",
  "summaryDeep": "Their presence and the way they carry themselves work smoothly with your drive, timing, and willingness to act. It runs easily and asks little, quietly steadying the rest of the bond. Lean on how naturally this one lines up."
}
