{
  "id": "A-moon_B-mars_trine",
  "kind": "interaspect",
  "planetA": "moon",
  "planetB": "mars",
  "aspect": "trine",
  "plainTranslation": "A's feelings meets B's drive. The trine lets them flow together easily.",
  "humanMoment": "{{holder2}}'s directness does not intimidate {{holder1}}, and {{holder1}}'s moods do not stall {{holder2}}'s momentum. Neither person has to manage or babysit the other.",
  "policy": "Governed by synastry-policy. Descriptive, not deterministic; intensity is never treated as obligation, safety concerns override astrology.",
  "note": "Synced from authored synastry bundle synastry-authored__19_ (2).json.",
  "voiceNeutral": true,
  "status": "DRAFT",
  "summaryDeep": "Their action and your feelings cooperate. They move you and you aim them. Let them help you act on what you feel.",
  "tension": "The only real risk is letting this good rhythm go unused. Because it is easier than the harder Moon-Mars contacts, you may not track how much it helps. The support is there, but it still needs somewhere to go.",
  "advice": "Use it. Say what you feel. Act on the care. Let the trust between you become something you actually build with.",
  "weight": 1,
  "authoringStatus": "draft",
  "summaryShort": "Their action and your feelings cooperate."
}
