{
  "id": "A-moon_B-pluto_opposition",
  "kind": "interaspect",
  "planetA": "moon",
  "planetB": "pluto",
  "aspect": "opposition",
  "plainTranslation": "A's feelings meets B's depth and power. The opposition pulls them into push-and-pull.",
  "policy": "Governed by synastry-policy. Descriptive, not deterministic; intensity is never treated as obligation, safety concerns override astrology.",
  "note": "Synced from authored synastry bundle synastry-authored__19_ (2).json.",
  "voiceNeutral": true,
  "status": "DRAFT",
  "summaryDeep": "This person has a way of reaching feelings you thought were buried, forgotten, or long resolved. Being around them can awaken emotions that have been sitting quietly beneath the surface for years, waiting for the right catalyst to bring them into the light.\n\nThere is a strong emotional pull between you, but it often comes with a sense of tension or imbalance. The Pluto person seems able to access the Moon person's deepest emotional terrain while remaining somewhat mysterious themselves. As a result, the Moon person may feel deeply affected by the connection, seen, exposed, changed, or unsettled, while the Pluto person appears to hold more of the emotional power or influence within the dynamic.\n\nAt its healthiest, this aspect encourages both people to be honest about what they are really feeling beneath the surface. The Pluto person may help the Moon person recognize emotions they have pushed aside, fears they have been avoiding, or relationship patterns they keep repeating without realizing it. When approached with care and self-awareness, the connection can shine a light on where each person wants deeper intimacy, where they struggle to trust, and where old emotional habits are getting in the way of the closeness they truly want.\n\nBut this aspect can also become an emotional power struggle. One person may reach while the other withdraws. One person may need reassurance while the other resists being needed. Jealousy, possessiveness, emotional testing, and manipulation can emerge when fear takes over. The bond can become difficult to step away from, not because it is always nourishing, but because it touches the attachment system so deeply.\n\nThe work is mutual care. Both people need to be honest about what they feel without using those feelings as weapons. This connection can deepen intimacy when vulnerability is respected. Without that respect, closeness can become destabilizing.",
  "tension": "But this aspect can also become an emotional power struggle. One person may reach while the other withdraws. One person may need reassurance while the other resists being needed. Jealousy, possessiveness, emotional testing, and manipulation can emerge when fear takes over. The bond can become difficult to step away from, not because it is always nourishing, but because it touches the attachment system so deeply.",
  "advice": "The work is mutual care. Both people need to be honest about what they feel without using those feelings as weapons. This connection can deepen intimacy when vulnerability is respected. Without that respect, closeness can become destabilizing.",
  "weight": 5,
  "authoringStatus": "draft"
}
